{"accepted_risks":[],"events":[],"project":{"created_at":"2026-07-28T00:00:00Z","currency":"GBP","locale":"en-GB","name":"Garage Follow-up","slug":"garage-follow-up","spelling":"british","timezone":"Europe/London","updated_at":"2026-07-28T00:00:00Z"},"render":{"last_rendered_at":null,"outputs":[],"theme":"qualification-lab"},"research":{"gaps":[],"market_identity":{"core_market":"Wealth","niche":"Independent garages"},"personas":[],"sources":[]},"schema_version":1,"tracks":{"offer":{"current_phase":"enhancement","phases":{"discovery":{"approved_at":"2026-07-28T00:00:00Z","data":{},"data_hash":"44136fa355b3678a1146ad16f7e8649e94fb4fc21fe77e8310c060f61caaff8a","evidence_refs":[],"input_revisions":{},"label":"Discovery","reviews":[{"issues":[],"reviewer":"sceptical-marketer","revision":1,"score":8,"submitted_at":"2026-07-28T00:00:00Z"},{"issues":[],"reviewer":"business-strategist","revision":1,"score":8,"submitted_at":"2026-07-28T00:00:00Z"}],"revision":1,"stale_reason":null,"status":"approved","summary":"Independent garages losing inbound enquiries."},"enhancement":{"approved_at":"2026-07-28T00:00:00Z","data":{"elevator_pitch":"A follow-up system for independent garages, installed in the inbox they already use.","guarantee":{"category":"Always-on","name":"No New CRM Promise","terms":"If the workflow needs a new CRM, the installation fee is refunded."},"offer_name":"The Five-Day Follow-up Fit","scarcity":"Five pilot installs per month","urgency":"Pilot pricing closes when the five slots are filled"},"data_hash":"e98866f6892622356b5580e74cd8e5e64d79ff71bc90092954d16b2288bf8990","evidence_refs":[],"input_revisions":{"discovery":1,"market":1,"pricing":1,"stack":1,"value":1},"label":"Enhancement","reviews":[{"issues":[],"reviewer":"sceptical-marketer","revision":1,"score":8,"submitted_at":"2026-07-28T00:00:00Z"},{"issues":[],"reviewer":"business-strategist","revision":1,"score":8,"submitted_at":"2026-07-28T00:00:00Z"}],"revision":1,"stale_reason":null,"status":"approved","summary":"Clear to test with five pilot garages."},"market":{"approved_at":"2026-07-28T00:00:00Z","data":{"core_market":"Wealth","niche":"Independent garages losing inbound enquiries"},"data_hash":"38fc4adf73f67731ca716dd001d57111623fd6b1105060381dfb8fc0523a05de","evidence_refs":[],"input_revisions":{"discovery":1},"label":"Starving Crowd","reviews":[{"issues":[],"reviewer":"sceptical-marketer","revision":1,"score":8,"submitted_at":"2026-07-28T00:00:00Z"},{"issues":[],"reviewer":"business-strategist","revision":1,"score":8,"submitted_at":"2026-07-28T00:00:00Z"}],"revision":1,"stale_reason":null,"status":"approved","summary":"Garages with 3-20 staff and no dedicated enquiry desk."},"pricing":{"approved_at":"2026-07-28T00:00:00Z","data":{"position":"High-Value Leader","price":1500},"data_hash":"9221401bf15d106941342be80794ca1ba870d2256533e92853b85b482e56e77a","evidence_refs":[],"input_revisions":{"discovery":1,"market":1},"label":"Pricing","reviews":[{"issues":[],"reviewer":"sceptical-marketer","revision":1,"score":8,"submitted_at":"2026-07-28T00:00:00Z"},{"issues":[],"reviewer":"business-strategist","revision":1,"score":8,"submitted_at":"2026-07-28T00:00:00Z"}],"revision":1,"stale_reason":null,"status":"approved","summary":"A fixed installation fee with monthly support."},"stack":{"approved_at":"2026-07-28T00:00:00Z","data":{"bonuses":[{"description":"Find where replies currently fail","name":"Missed enquiry audit","value":500}],"core":{"description":"Installed with the garage's existing inbox","name":"Five-day enquiry follow-up system","value":2500},"price":1500,"total_value":3000},"data_hash":"ea7ba6cd51343ff91065bf33dbc5d67d43202ec075de26032743f31a6aa4917c","evidence_refs":[],"input_revisions":{"discovery":1,"market":1,"pricing":1,"value":1},"label":"Offer Stack","reviews":[{"issues":[],"reviewer":"sceptical-marketer","revision":1,"score":8,"submitted_at":"2026-07-28T00:00:00Z"},{"issues":[],"reviewer":"business-strategist","revision":1,"score":8,"submitted_at":"2026-07-28T00:00:00Z"}],"revision":1,"stale_reason":null,"status":"approved","summary":"Installation, inbox rules and response templates."},"value":{"approved_at":"2026-07-28T00:00:00Z","data":{"dream_outcome":"Every enquiry gets a useful reply","dream_score":8,"effort_sacrifice":"No new CRM","effort_score":8,"likelihood_score":7,"perceived_likelihood":"Installed in the existing inbox","time_delay":"Five days","time_score":8},"data_hash":"0381f42d7eea5b04a89d5da8dc8c9e1da87b22a66b3e1028f23e4df004ee4179","evidence_refs":[],"input_revisions":{"discovery":1,"market":1,"pricing":1},"label":"Value Equation","reviews":[{"issues":[],"reviewer":"sceptical-marketer","revision":1,"score":8,"submitted_at":"2026-07-28T00:00:00Z"},{"issues":[],"reviewer":"business-strategist","revision":1,"score":8,"submitted_at":"2026-07-28T00:00:00Z"}],"revision":1,"stale_reason":null,"status":"approved","summary":"Visible first result within five days."}}}},"workspace_revision":0}
